{"cases":[{"candidate_id":"ECP-CAND-000001","content_hash":"d93ee1810e1a63a07e6a6446b988e5289a85beda959b83b589a9b0cf918d0004","gt_validation_track":"CONFIRMED-TRACK","qualification_artifact_hash":"21df33d5afc2fac8f66a3aa9d8834953f10441bdf96ca157663a3d8968863ed9","qualification_id":"ECP-QUAL-900001","set_class":"PROTECTED","source_case_id":"S-001"}],"content_class":"format-illustration","ecp_object":"registration-manifest","execution_isolation":"manifest freeze only: NO evaluated model execution; NO case execution; NO results","immutability":"append-only freeze: the manifest may change only through the amendment protocol (two-phase disclosure, full re-review, nothing inherited); ground truth sealed at registration; no post-hoc changes (order §11/§12)","manifest_hash":"6ac9ea2308fe9c1e8ab724b7a2143cb785578834964bc8b79db6eacbc0ff3300","population_decision":"30-ONLY","protocol_version":"0.6.0","readiness_run":{"assessed_at":"2026-09-09T00:00:00Z","engine":{"id":"ECP-READINESS-ENGINE-1","profile":"0.6.0","version":"0.6.0"},"run_hash":"a880fe8ea257601a97a8f9d0abf276d45a761b7ba1afd93cdd51231321b66272","run_id":"ECP-RDNYRUN-EXAMPLE"},"registered_at":"2026-09-09T00:00:00Z","registrar":"ECP-REGISTRAR-EXAMPLE (FORMAT ILLUSTRATION: public dummy values)","registration_id":"ECP-REGSET-EXAMPLE-0001","schema_version":"0.6.0","set_binding_reference":null}